{
  "scanner": "scan-all",
  "target": "examples/02-portfolio/before",
  "timestamp": "2026-10-21T00:00:00.000Z",
  "counts": {
    "S0": 25,
    "S1": 15,
    "S2": 8,
    "S3": 0,
    "total": 48
  },
  "passed": false,
  "findings": [
    {
      "ruleId": "en-unlock",
      "severity": "S1",
      "file": "index.html",
      "line": 15,
      "excerpt": "<p>Lorem ipsum dolor sit amet. Unlock the power of AI with our seamless integration.</p>",
      "message": "Metaphorical cliche used in generic SaaS copy.",
      "fix": "Name the capability the user gains."
    },
    {
      "ruleId": "en-seamless",
      "severity": "S1",
      "file": "index.html",
      "line": 15,
      "excerpt": "<p>Lorem ipsum dolor sit amet. Unlock the power of AI with our seamless integration.</p>",
      "message": "Filler adjective claiming zero friction without proof.",
      "fix": "Explain how the integration works in practice."
    },
    {
      "ruleId": "en-supercharge",
      "severity": "S1",
      "file": "index.html",
      "line": 13,
      "excerpt": "In today's fast-paced world, supercharge your workflow",
      "message": "Exaggerated action verb.",
      "fix": "State the throughput or speed gain."
    },
    {
      "ruleId": "en-fast-paced-world",
      "severity": "S0",
      "file": "index.html",
      "line": 13,
      "excerpt": "In today's fast-paced world, supercharge your workflow",
      "message": "Classic LLM throat-clearing opener.",
      "fix": "Delete the opener and start with the problem."
    },
    {
      "ruleId": "en-crafted-with-love",
      "severity": "S1",
      "file": "index.html",
      "line": 21,
      "excerpt": "<section class=\"py-20\"><footer>Crafted with ❤️ by John Doe at Acme Corp.</footer></section>",
      "message": "Template footer cliche.",
      "fix": "State the company name, location, or year."
    },
    {
      "ruleId": "en-unlock-power-ai",
      "severity": "S0",
      "file": "index.html",
      "line": 15,
      "excerpt": "<p>Lorem ipsum dolor sit amet. Unlock the power of AI with our seamless integration.</p>",
      "message": "Canonical AI wrapper slogan.",
      "fix": "Describe the exact task the model performs."
    },
    {
      "ruleId": "en-trusted-by-thousands",
      "severity": "S0",
      "file": "index.html",
      "line": 19,
      "excerpt": "<section class=\"py-20\"><p>Trusted by thousands of companies worldwide.</p></section>",
      "message": "Unverified social proof cliche.",
      "fix": "Use exact verified customer counts and real names, or remove."
    },
    {
      "ruleId": "en-10k-happy-users",
      "severity": "S0",
      "file": "index.html",
      "line": 20,
      "excerpt": "<section class=\"py-20\"><p>Join 10,000+ happy users.</p></section>",
      "message": "Template social proof number.",
      "fix": "Replace with a real audited metric or cut the counter."
    },
    {
      "ruleId": "en-learn-more-cta",
      "severity": "S1",
      "file": "index.html",
      "line": 16,
      "excerpt": "<a href=\"#\">Learn More</a>",
      "message": "Vague link label that fails screen-reader context.",
      "fix": "Name the destination page."
    },
    {
      "ruleId": "en-click-here-link",
      "severity": "S1",
      "file": "index.html",
      "line": 17,
      "excerpt": "<a href=\"https://example.com\">Click Here</a>",
      "message": "Non-descriptive anchor text.",
      "fix": "Describe where the link leads."
    },
    {
      "ruleId": "en-lorem-ipsum",
      "severity": "S0",
      "file": "index.html",
      "line": 15,
      "excerpt": "<p>Lorem ipsum dolor sit amet. Unlock the power of AI with our seamless integration.</p>",
      "message": "Explicit placeholder Latin copy.",
      "fix": "Replace with real copy or [CLIENT INPUT NEEDED]."
    },
    {
      "ruleId": "en-dolor-sit-amet",
      "severity": "S0",
      "file": "index.html",
      "line": 15,
      "excerpt": "<p>Lorem ipsum dolor sit amet. Unlock the power of AI with our seamless integration.</p>",
      "message": "Explicit placeholder Latin copy.",
      "fix": "Write the actual paragraph."
    },
    {
      "ruleId": "en-john-doe",
      "severity": "S0",
      "file": "index.html",
      "line": 21,
      "excerpt": "<section class=\"py-20\"><footer>Crafted with ❤️ by John Doe at Acme Corp.</footer></section>",
      "message": "Placeholder persona name.",
      "fix": "Use a real person with permission or a domain-authentic example."
    },
    {
      "ruleId": "en-acme-corp",
      "severity": "S0",
      "file": "index.html",
      "line": 21,
      "excerpt": "<section class=\"py-20\"><footer>Crafted with ❤️ by John Doe at Acme Corp.</footer></section>",
      "message": "Cartoon placeholder company.",
      "fix": "Use a realistic domain scenario or real client."
    },
    {
      "ruleId": "en-supercharge-workflow",
      "severity": "S1",
      "file": "index.html",
      "line": 13,
      "excerpt": "In today's fast-paced world, supercharge your workflow",
      "message": "Canonical AI landing page H1.",
      "fix": "State the exact task automated."
    },
    {
      "ruleId": "ph-john-jane-doe",
      "severity": "S0",
      "file": "index.html",
      "line": 21,
      "excerpt": "<section class=\"py-20\"><footer>Crafted with ❤️ by John Doe at Acme Corp.</footer></section>",
      "message": "Generic placeholder person name.",
      "fix": "Use a real team member or culturally grounded domain example."
    },
    {
      "ruleId": "ph-acme-globex-initech",
      "severity": "S0",
      "file": "index.html",
      "line": 21,
      "excerpt": "<section class=\"py-20\"><footer>Crafted with ❤️ by John Doe at Acme Corp.</footer></section>",
      "message": "Pop-culture fictional corporation name.",
      "fix": "Use a real organization or realistic industry description."
    },
    {
      "ruleId": "ph-lorem-ipsum-short",
      "severity": "S0",
      "file": "index.html",
      "line": 15,
      "excerpt": "<p>Lorem ipsum dolor sit amet. Unlock the power of AI with our seamless integration.</p>",
      "message": "Placeholder ipsum generator text.",
      "fix": "Write real domain copy."
    },
    {
      "ruleId": "code-console-log-emoji",
      "severity": "S1",
      "file": "app.js",
      "line": 5,
      "excerpt": "console.log('🚀 Clicked!');",
      "message": "Emoji-prefixed `console.log` statement typical of LLM debugging output.",
      "fix": "Use structured logger calls or remove debug logs before committing."
    },
    {
      "ruleId": "code-todo-implement-later",
      "severity": "S0",
      "file": "app.js",
      "line": 8,
      "excerpt": "// TODO: implement real logic later",
      "message": "Unfinished LLM stub comment (`// TODO: implement later`).",
      "fix": "Implement the required behavior before shipping."
    },
    {
      "ruleId": "code-alert-window-form-submit",
      "severity": "S0",
      "file": "app.js",
      "line": 6,
      "excerpt": "alert('Thank you for contacting us!');",
      "message": "Browser `alert('Thank you...')` used instead of inline form feedback.",
      "fix": "Render an inline confirmation banner with a reference number."
    },
    {
      "ruleId": "code-dummy-data-array",
      "severity": "S0",
      "file": "app.js",
      "line": 3,
      "excerpt": "const dummyData = [{ id: 1, name: 'Sarah Jenkins', company: 'TechFlow' }];",
      "message": "Hardcoded `dummyData` / `mockData` array in application code.",
      "fix": "Load real records from the data layer or name domain fixtures accurately in test files."
    },
    {
      "ruleId": "code-handle-click-generic",
      "severity": "S2",
      "file": "app.js",
      "line": 4,
      "excerpt": "const handleClick = () => {",
      "message": "Generic `handleClick` identifier that hides what action occurs.",
      "fix": "Name handlers after the domain effect (`handleApproveInvoice`, `handleExportCsv`)."
    },
    {
      "ruleId": "code-comment-initialize-state",
      "severity": "S2",
      "file": "app.js",
      "line": 2,
      "excerpt": "// Initialize state",
      "message": "Redundant comment restating syntax (`// Initialize state`).",
      "fix": "Delete comments that merely narrate the next line of syntax."
    },
    {
      "ruleId": "code-ai-generated-header-comment",
      "severity": "S0",
      "file": "app.js",
      "line": 1,
      "excerpt": "// Generated by Claude",
      "message": "Source header comment attributing file to an AI generator.",
      "fix": "Remove generator attribution comments."
    },
    {
      "ruleId": "code-fake-testimonial-array",
      "severity": "S0",
      "file": "app.js",
      "line": 3,
      "excerpt": "const dummyData = [{ id: 1, name: 'Sarah Jenkins', company: 'TechFlow' }];",
      "message": "Canonical LLM fictional testimonial persona names (`Sarah Jenkins`, `Michael Chen`, `Emily Rodriguez`).",
      "fix": "Never invent testimonials. Use verified client quotes with permission or `[CLIENT INPUT NEEDED]`."
    },
    {
      "ruleId": "code-techflow-innovatecorp-names",
      "severity": "S0",
      "file": "app.js",
      "line": 3,
      "excerpt": "const dummyData = [{ id: 1, name: 'Sarah Jenkins', company: 'TechFlow' }];",
      "message": "Synthetic LLM company names used in fake case studies or testimonials.",
      "fix": "Use real client names with permission or remove the fictional company."
    },
    {
      "ruleId": "css-indigo-purple-pink",
      "severity": "S1",
      "file": "index.html",
      "line": 12,
      "excerpt": "<h1 class=\"bg-clip-text text-transparent bg-gradient-to-r from-indigo-500 via-purple-500 to-pink-500\">",
      "message": "Canonical default AI hero gradient.",
      "fix": "Use a solid surface or a two-stop gradient sampled from brand photography."
    },
    {
      "ruleId": "css-purple-pink-clip",
      "severity": "S1",
      "file": "index.html",
      "line": 12,